{
  "$schema": "https://json-schema.org/draft/2020-12/schema",
  "$id": "https://research-harness.dev/schema/artifact.schema.json",
  "title": "Findings-to-Artifact Contract",
  "description": "The typed intermediate the report-synthesizer produces from surviving findings and that every output channel renders (SPEC §6d). It separates the two orthogonal axes — the deliverable genre (what the document is) and the delivery channel (how it is rendered). Blog is the first-class channel; book and other channels arrive via optional channel packs. Every section traces to the MIF finding @ids it draws on, and every source is a MIF-shaped citation, so the citation-integrity and citation-leak gates run uniformly across all outputs.",
  "type": "object",
  "required": ["@type", "title", "genre", "sections", "sources", "finding_refs"],
  "additionalProperties": false,
  "properties": {
    "@type": { "const": "Artifact" },
    "title": { "type": "string", "minLength": 1 },
    "subtitle": { "type": "string" },
    "genre": {
      "type": "string",
      "description": "The deliverable genre (exec-summary, academic, engineering, …). 'general' when no genre pack is enabled.",
      "pattern": "^[a-z][a-z0-9-]*$"
    },
    "audience": { "type": "string" },
    "namespace": {
      "type": "string",
      "pattern": "^[a-zA-Z0-9_-]+(/[a-zA-Z0-9_-]+)*$",
      "description": "The MIF namespace of the surviving finding set, carried through so the generic `report` projection can mint its id (MIF 1.4: urn:mif:<uuid>, uuid5 of report:<namespace>:<slug>) id."
    },
    "newsworthiness": {
      "type": "string",
      "enum": ["high", "medium", "low"],
      "description": "The delta/newsworthiness signal the engine computes — the hook a publication pipeline needs (SPEC §6d)."
    },
    "finding_refs": {
      "type": "array",
      "minItems": 1,
      "description": "The MIF finding @ids this artifact synthesizes (urn:mif:).",
      "items": { "type": "string", "pattern": "^urn:mif:" }
    },
    "sections": {
      "type": "array",
      "minItems": 1,
      "description": "Ordered body sections; the genre template defines which are required.",
      "items": {
        "type": "object",
        "required": ["heading", "body"],
        "additionalProperties": false,
        "properties": {
          "heading": { "type": "string", "minLength": 1 },
          "body": { "type": "string", "minLength": 1 },
          "supports": {
            "type": "array",
            "description": "MIF finding @ids this section draws on.",
            "items": { "type": "string", "pattern": "^urn:mif:" }
          },
          "sources": {
            "type": "array",
            "description": "The citations of the finding(s) this section rests on, so every channel can attribute evidence per finding (diataxis-level rigor) rather than only as a flat list. Same MIF citation shape as the top-level sources[].",
            "items": {
              "type": "object",
              "required": ["title", "url"],
              "properties": {
                "title": { "type": "string" },
                "url": { "type": "string", "format": "uri" },
                "citationType": { "type": "string" },
                "citationRole": { "type": "string" }
              }
            }
          },
          "entities": {
            "type": "array",
            "description": "The named entities (concepts, technologies, organizations) the finding references, carried through for per-section context.",
            "items": {
              "type": "object",
              "properties": {
                "id": { "type": "string", "description": "The entity's MIF @id, carried so a per-section diagram can render the entity as a labeled, de-duplicated node." },
                "name": { "type": "string" },
                "entityType": { "type": "string" }
              }
            }
          },
          "relationships": {
            "type": "array",
            "description": "The finding's typed relationships, carried through so a per-section Mermaid graph can render edges (finding -> target) instead of omitting the diagram.",
            "items": {
              "type": "object",
              "properties": {
                "type": { "type": "string" },
                "target": { "type": "string" },
                "strength": { "type": "number" }
              }
            }
          },
          "dimension": {
            "type": "string",
            "description": "The research dimension the finding belongs to."
          },
          "verdict": {
            "type": "string",
            "description": "The finding's adversarial-falsification verdict (survived | weakened | inconclusive)."
          },
          "entityType": {
            "type": "string",
            "description": "The FINDING's resolved ontology entity type, joined from reports/<topic>/ontology-map.json by finding @id. Distinct from entities[].entityType (which types each referenced EntityReference). Optional — present only when the topic has a resolved ontology-map."
          },
          "ontology": {
            "type": "string",
            "description": "id@version of the ontology that resolved the finding's type (e.g. mif-generic@1.0.0)."
          },
          "basis": {
            "type": "string",
            "description": "How the finding's type was resolved, as recorded by scripts/resolve-ontology.sh: declared | resolved | discovery | untyped | unresolved | ambiguous."
          }
        }
      }
    },
    "sources": {
      "type": "array",
      "minItems": 1,
      "description": "MIF-shaped citations, deduplicated across the finding set. citationType/citationRole carry the full MIF Level-3 citation shape so a report projection (reports/<topic>/<slug>.md) validates at L3, not just title+url.",
      "items": {
        "type": "object",
        "required": ["title", "url", "citationType", "citationRole"],
        "properties": {
          "title": { "type": "string", "minLength": 1 },
          "url": { "type": "string", "format": "uri" },
          "citationType": {
            "type": "string",
            "description": "MIF citation source category (article, paper, documentation, …). Required so a report projection (reports/<topic>/<slug>.md) satisfies the MIF Level-3 citation shape — an artifact missing it cannot be rendered/validated as a report."
          },
          "citationRole": {
            "type": "string",
            "description": "MIF citation relationship to the claim (supports, background, …). Required for the same L3 report-projection reason as citationType."
          }
        }
      }
    },
    "mif": {
      "type": "object",
      "description": "MIF output-conformance marker (SPEC §10). The report-synthesizer stamps how this artifact's report projection is to be treated by the MIF I/O conformance gate.",
      "additionalProperties": false,
      "properties": {
        "conformanceLevel": {
          "type": "integer",
          "enum": [1, 2, 3],
          "description": "The MIF level the generic `report` projection of this artifact meets (3 for a falsification-graded report)."
        }
      }
    }
  }
}
